ID	E	EFINP	NOT	NFP	IAD	text
107326-01-01	0	0	0	0	0	Supergrass « Road To Rouen »
107326-02-01	0	0	0	0	0	( Parlophone / EMI )
107326-03-01	1	0	0	0	0	Forbausende matt fra britiske popveteraner .
107326-04-01	1	0	0	0	0	Supergrass har muligens hørt vel mye på Led Zeppelin det siste året , for i åpningssporet « Tales Of Endurance ( Parts 4 , 5 & 6 ) » går de legendene i næringen på en måte som dessverre avslører hvilken autoritet Supergrass mangler for å komme opp på samme høyder .
107326-04-02	1	0	0	0	0	Resten av platen bygger videre på mye av Zeppelins flytende psykedelia , men låtene - med hederlig unntak i tittellåten - mangler ethvert gripetak som er nødvendig for å fange interessen .
107326-04-03	1	0	0	0	0	Det som tidligere var et skarpt , morsomt og friskt band , er blitt matt , melankolsk og mistilpasset .
