ID	E	EFINP	NOT	NFP	IAD	text
103512-01-01	0	0	0	0	0	Björn Rosenström :
103512-01-02	0	0	0	0	0	« Pop på svenska »
103512-02-01	0	0	0	0	0	( Rosenström musikk )
103512-03-01	0	0	0	0	0	Nytt album fra svensken som ønsker å kalle seg norgesvenn etter en rekke konserter her i landet .
103512-04-01	1	0	0	0	0	Vorspielartisten Björn Rosenström beholder nok sine mange norske fans og skaffer seg nok noen nye etter at de har hørt « Pop på svenska » .
103512-05-01	1	0	0	0	0	Dette er en god popplate , mer bandpreget og mindre rølpete enn vi har hør fra Rosenström før .
103512-06-01	1	0	0	0	0	Den juristutdannede sangeren serverer variert syng-med-popmusikk med ironiske og humorfylte tekster .
103512-06-02	0	0	0	0	0	På det nye albumet hyller svensken både « Hultsfredfestivalen » , mamma Magdalena og forteller hvordan det er å bli « Piercad i ollonet » .
103512-07-01	1	0	0	0	0	Rosenström har laget en jevnt god plate som lever opp til platetittelen .
